{
  "slice_id": "slice-02-init-docs-and-i18n-assets",
  "ticket": "QUIVER-42-02",
  "type": "feature",
  "title": "Init docs and i18n assets",
  "objective": "Localize init-generated human docs and onboarding assets while preserving machine artifacts.",
  "description": "Applies template language routing to init and related generated docs.",
  "git": {
    "branch_type": "feature",
    "base_branch": "main",
    "branch_slug": "v42-init-docs-i18n-assets",
    "branch_name": "feature/QUIVER-42-02-v42-init-docs-i18n-assets"
  },
  "files": [
    "src/create-quiver/index.js",
    "src/create-quiver/lib/init-docs.js",
    "src/create-quiver/lib/i18n/templates.js",
    "docs/*.es.template",
    "docs/ai/*.es.template",
    "AGENTS.md.es.template",
    "tests/commands/init-profiles.test.js",
    "tests/commands/demo.test.js",
    "specs/quiver-v42-cli-i18n-generated-docs/**"
  ],
  "expected_read_paths": [
    "src/create-quiver/index.js",
    "src/create-quiver/lib/init-docs.js",
    "src/create-quiver/lib/i18n/templates.js",
    "docs/INDEX.md",
    "docs/*.template"
  ],
  "allowed_write_paths": [
    "src/create-quiver/index.js",
    "src/create-quiver/lib/init-docs.js",
    "src/create-quiver/lib/i18n/**",
    "AGENTS.md.es.template",
    "docs/**",
    "tests/commands/init-profiles.test.js",
    "tests/commands/demo.test.js",
    "specs/quiver-v42-cli-i18n-generated-docs/**"
  ],
  "depends_on": [
    "slice-01-template-language-routing"
  ],
  "parallel_safe": "conditional",
  "parallel_safe_reason": "Can overlap with docs reference work after routing is stable.",
  "must": [
    "Localize init-generated human docs.",
    "Preserve machine artifacts.",
    "Preserve overwrite behavior.",
    "Test configured language and --lang override."
  ],
  "not_included": [
    "Runtime CLI output migration."
  ],
  "acceptance": [
    "Generated docs can be produced in en and es.",
    "Machine artifacts stay stable across languages.",
    "Existing docs are not unexpectedly overwritten."
  ],
  "tests": [
    "node --test tests/commands/init-profiles.test.js tests/commands/demo.test.js tests/lib/init-docs.test.js tests/lib/i18n-templates.test.js",
    "git diff --check"
  ],
  "validation_hints": [
    "Use temporary projects to compare generated docs by language."
  ],
  "estimated_hours": 8,
  "status": "completed",
  "blocked_reason": "",
  "completed_at": "2026-05-29T18:58:19Z"
}
