{
  "slice_id": "slice-03-effective-amendments",
  "ticket": "QUIVER-INIT-A",
  "type": "feature",
  "title": "Build deterministic addendum and amendment contracts",
  "objective": "Create immutable addendum records bound to parent digest and required input identity; resolve effective content with ordered lineage.",
  "description": "V59: V59-RQ-04, V59-RQ-05, V59-RQ-08. Build deterministic addendum and amendment contracts.",
  "git": {
    "branch_type": "feature",
    "base_branch": "main",
    "branch_slug": "engine-trust",
    "branch_name": "feature/QUIVER-INIT-A-engine-trust"
  },
  "expected_read_paths": [
    "docs/INDEX.md",
    "docs/programs/quiver-v6/PROGRAM.md",
    "specs/quiver-init-a-engine-trust/SPEC.md",
    "docs/requirements/initiatives/REQ-QUIVER-INIT-A-ENGINE-TRUST-v1.0.3.md",
    "specs/quiver-init-a-engine-trust/CONTRACTS.md"
  ],
  "files": [
    "src/create-quiver/lib/ai/draft-integrity.js",
    "src/create-quiver/lib/ai/effective-contract.js",
    "src/create-quiver/lib/ai/review-budget.js",
    "tests/lib/effective-contract.test.js",
    "specs/quiver-init-a-engine-trust/**"
  ],
  "allowed_write_paths": [
    "src/create-quiver/lib/ai/draft-integrity.js",
    "src/create-quiver/lib/ai/effective-contract.js",
    "src/create-quiver/lib/ai/review-budget.js",
    "tests/lib/effective-contract.test.js",
    "specs/quiver-init-a-engine-trust/**"
  ],
  "depends_on": [
    "slice-02-draft-recovery"
  ],
  "parallel_safe": "conditional",
  "parallel_safe_reason": "DEC-A-013: preserve every dependency; the draft and Brain/context tracks may overlap only with disjoint product write sets. Serialize slices 04 and 06 at the CLI/registry/i18n/reference surface; coordinator owns shared spec metadata.",
  "must": [
    "Create immutable addendum records bound to parent digest and required input identity; resolve effective content with ordered lineage.",
    "Accept deterministic structured operations addressed by stable IDs for supported JSON sections only; reject arbitrary source execution and ambiguous Markdown patching.",
    "Require explicit removals and affected identities, verify references after operations, detect cycles/missing parents/tamper.",
    "Reuse v58 review-event classification; retry keeps request identity and cannot masquerade as a free semantic revision."
  ],
  "not_included": [
    "Unrelated initiative behavior",
    "Production deploy or npm publication",
    "Forged evidence, reduced acceptance or discarded history"
  ],
  "acceptance": [
    "Addendum augments content while preserving parent; effective digest reproducible.",
    "Amendment changes one ID, explicit delete repairs references or fails; malformed operations and stale parents rejected.",
    "Retry vs new semantic revision preserves distinct ledger identities and budget consumption."
  ],
  "tests": [
    "LANG=en_US.UTF-8 LC_ALL=en_US.UTF-8 node --test tests/lib/effective-contract.test.js",
    "git diff --check"
  ],
  "estimated_hours": 0,
  "status": "draft"
}
